{
    "pipeline_uuid": "f0f417f2-ba8b-5ac4-b421-255b69553391",
    "archive_path": "products/v1/beb14196-a09c-5c93-b0af-0234a8d14123/0e704c02-c1ab-5c4d-8fb9-a68399e9396d/7157e2f6-e231-5fc6-9f50-0519e183dd37/3b98ff33-d982-5cdc-9f02-5a70471e9629/solid-snake-20180913T162843Z",
    "data": {"param1": "value1"},
    "session": "solid-snake"
}
