{
    "pipeline_uuid": "1064aaf1-459c-5e42-820d-b822aa4b3990",
    "archive_path": "/sample/tacc-cloud/agavehelpers/upload",
    "data": {
        "param1": "value1",
        "param2": 1,
        "param3": true,
        "param4": [
            1,
            2,
            3
        ],
        "param5": [
            "a",
            "b",
            "c"
        ]
    },
    "session": "solid-snake"
}
